{
  "$schema": "http://json-schema.org/draft-07/schema#",
  "title": "SafeSOC LLM triage output",
  "description": "The structured verdict the LLM must return per alert_package; the validator parses this.",
  "type": "object",
  "required": ["verdict", "severity", "confidence", "key_evidence", "rationale", "recommended_action"],
  "properties": {
    "verdict": {"enum": ["malicious", "suspicious", "benign"]},
    "severity": {"enum": ["critical", "high", "medium", "low", "informational"]},
    "confidence": {"type": "number", "minimum": 0, "maximum": 1,
      "description": "Self-reported confidence in the overall triage decision. Analysed only as an exploratory dataset-level metric; it never overrides C1-C4."},
    "key_evidence": {"type": "array", "items": {"type": "string"}, "minItems": 1,
      "description": "Evidence ids (A0 / EV-xxx / DER-xxx) the verdict rests on."},
    "rationale": {"type": "string", "minLength": 1,
      "description": "Free-text justification. Explicit evidence IDs are checked by C1/C3; broader semantic over-reach is reviewed qualitatively rather than inferred by brittle keyword rules."},
    "recommended_action": {"enum": ["isolate", "escalate", "investigate", "monitor", "close_benign"]}
  },
  "additionalProperties": false
}
