{
  "verdict": "suspicious",
  "severity": "high",
  "confidence": 0.9,
  "key_evidence": [
    "A0",
    "EV-001",
    "EV-002",
    "EV-003",
    "EV-004"
  ],
  "rationale": "The activity involves setting DefaultUserName and DefaultPassword in the Winlogon registry (A0, EV-001, EV-002, EV-003), which is a known persistence mechanism for automatic logon. While the DefaultPassword was subsequently deleted (EV-004), the initial modification of these sensitive registry keys is highly suspicious, especially when executed from a batch file via cmd.exe.",
  "recommended_action": "investigate"
}