{
  "verdict": "benign",
  "severity": "informational",
  "confidence": 0.9,
  "key_evidence": [
    "A0"
  ],
  "rationale": "The alert (A0) shows rundll32.exe loading davclnt.dll and calling DavSetCookie, which is a legitimate function for WebDAV client operations. The parent process is svchost.exe running the WebClient service, and the target URL (d.docs.live.net) is a legitimate Microsoft domain, indicating normal system activity related to cloud file access.",
  "recommended_action": "close_benign"
}
