{
  "verdict": "suspicious",
  "severity": "medium",
  "confidence": 0.55,
  "key_evidence": [
    "A0",
    "EV-003",
    "EV-004",
    "DER-001"
  ],
  "rationale": "The PowerShell command in A0 uses string concatenation obfuscation and pipes to IEX (Invoke-Expression), which are classic obfuscation/execution techniques; however, DER-001 confirms the deobfuscated payload is merely 'Write-Host Hello, World!' \u2014 a benign output command with no confirmed malicious effect. The obfuscation pattern itself warrants suspicion even if the resolved payload is trivial, as it could represent a test or proof-of-concept for a delivery mechanism. More concerning are EV-003 and EV-004, where lsass.exe (PID 852) accesses the PowerShell process (PID 3196) with access mask 0x1478 \u2014 a combination that includes PROCESS_VM_READ and other rights consistent with credential-access tooling \u2014 though the call trace shows an RPC/SSPI path that could reflect legitimate authentication activity rather than credential dumping. No confirmed malicious outcome (e.g., credential exfiltration, lateral movement, persistence) is evidenced, but the combination of obfuscated IEX invocation under a high-integrity Administrator context and lsass-to-PowerShell process access warrants further investigation.",
  "recommended_action": "investigate"
}