{
  "verdict": "suspicious",
  "severity": "medium",
  "confidence": 0.8,
  "key_evidence": [
    "A0",
    "EV-001"
  ],
  "rationale": "The 'reg.exe' process, initiated from a user's Downloads directory via 'cmd.exe' (EV-001), modified the 'Start' value of the 'EventLog' service to '4' (A0). This action disables the Windows Event Log service, which is a common tactic for adversaries to hinder forensic analysis and hide their activities. While 'reg.exe' is a legitimate tool, its use in this context and from this location is highly suspicious.",
  "recommended_action": "investigate"
}